{
  "check_id": "script_claim_evidence_v1",
  "created_at": "2026-10-21T11:00:00Z",
  "gate_id": "script_gate_v1",
  "manifest_id": "qim_script_01",
  "policy_snapshot_artifact_id": "artifact_policy_snapshot_v1",
  "schema_version": "quality-input-manifest.v1",
  "supporting_artifact_ids": [
    "artifact_evidence_01"
  ],
  "target_artifact_ids": [
    "artifact_script_v1"
  ],
  "target_hashes": {
    "artifact_script_v1": "d4fd7efaaf9fde5f2e32c5d13d5d900d9bf7592c60a601cece8addf1b3b234f7"
  }
}
